title,source,url,date,priority,relevance_score,summary,hash
AfriMed-QA: Benchmarking large language models for global health,RSS,https://research.google/blog/afrimed-qa-benchmarking-large-language-models-for-global-health/,"Wed, 24 Sep 2025 19:11:00 +0000",high,8,Generative AI.,8654fddc9c2fb7f4b08acd1e8ed0ff50
"Speculative cascades — A hybrid approach for smarter, faster LLM inference",RSS,https://research.google/blog/speculative-cascades-a-hybrid-approach-for-smarter-faster-llm-inference/,"Thu, 11 Sep 2025 22:01:00 +0000",high,8,Generative AI.,29d1ef4373b1a6f7527981824e9b28d2
VaultGemma: The world's most capable differentially private LLM,RSS,https://research.google/blog/vaultgemma-the-worlds-most-capable-differentially-private-llm/,"Fri, 12 Sep 2025 08:14:00 +0000",high,8,Generative AI.,3b6d1b67e72fa547b9b412bf92056ec8
Thoughts on America’s AI Action Plan,www.anthropic.com,https://www.anthropic.com/news/thoughts-on-america-s-ai-action-plan,2025-09-25 16:13:07.812522,critical,8,,2db448a7941282c9e23721117da3bf33
Anthropic raises $13B Series F at $183B post-money valuation,www.anthropic.com,https://www.anthropic.com/news/anthropic-raises-series-f-at-usd183b-post-money-valuation,2025-09-25 16:13:01.470620,critical,8,"AnnouncementsAnthropic raises $13B Series F at $183B post-money valuationSep 2, 2025●3 min readAnthropic has completed a Series F fundraising of $13 billion led by ICONIQ.",e788afa9acb8b35da2d64d1303bffa88
Making LLMs more accurate by using all of their layers,RSS,https://research.google/blog/making-llms-more-accurate-by-using-all-of-their-layers/,"Wed, 17 Sep 2025 17:00:00 +0000",high,7,Algorithms & Theory.,8fe0815b42ac070603d3c0fb42411b97
Claude Opus 4.1,www.anthropic.com,https://www.anthropic.com/news/claude-opus-4-1,2025-09-25 16:12:58.676737,critical,7,"AnnouncementsClaude Opus 4. 1Aug 5, 2025●1 min readToday we're releasing Claude Opus 4. 1, an upgrade to Claude Opus 4 on agentic tasks, real-world coding, and reasoning.",739d2be5aeeebe339ddcbfd4773822c7
"Creating a safe, observable AI infrastructure for 1 million classrooms",RSS,https://openai.com/index/schoolai,"Mon, 22 Sep 2025 10:00:00 GMT",critical,6,"Discover how SchoolAI, built on OpenAI’s GPT-4.",d068231d1c94faacce1ef7b98384b8a2
Claude is now available in Microsoft 365 Copilot,www.anthropic.com,https://www.anthropic.com/news/claude-now-available-in-microsoft-365-copilot,2025-09-25 16:13:04.631160,critical,6,,cb4b46a366bda4c00aff0456ed24b9e4
Transforming the manufacturing industry with ChatGPT,RSS,https://openai.com/index/eneos-materials,"Wed, 24 Sep 2025 17:00:00 GMT",high,5,"By deploying ChatGPT Enterprise, ENEOS Materials transformed operations with faster research, safer plant design, and streamlined HR processes.",f15a22143ce1548a7c17d8db2b1ff5cc
SAP and OpenAI partner to launch sovereign ‘OpenAI for Germany’,RSS,https://openai.com/global-affairs/openai-for-germany,"Wed, 24 Sep 2025 04:00:00 GMT",critical,5,"SAP and OpenAI launch OpenAI for Germany, a 2026 partnership to bring secure, sovereign AI to Germany’s public sector, enabling safe, efficient public services.",e3577d60889a5bbe72a74f7dbe163dcc
"OpenAI, Oracle, and SoftBank expand Stargate with five new AI datacenter sites",RSS,https://openai.com/index/five-new-stargate-sites,"Tue, 23 Sep 2025 14:00:00 GMT",medium,5,"OpenAI, Oracle, and SoftBank announce five new Stargate AI datacenter sites, accelerating a $500B, 10-gigawatt U. S.",ee761575dd7a2027e4bb1efa019e261c
Learn Your Way: Reimagining textbooks with generative AI,RSS,https://research.google/blog/learn-your-way-reimagining-textbooks-with-generative-ai/,"Tue, 16 Sep 2025 17:01:00 +0000",medium,5,Education Innovation.,a959e6f755285d4a219b3b522b2cba52
More ways to work with your team and tools in ChatGPT,RSS,https://openai.com/index/more-ways-to-work-with-your-team,"Thu, 25 Sep 2025 11:00:00 GMT",high,5,"ChatGPT business plans now support shared projects, smarter connectors, and enhanced compliance features to help teams work faster and more securely.",b89d4fe8abe08537c2a4554a99fdcac1
Introducing ChatGPT Pulse,RSS,https://openai.com/index/introducing-chatgpt-pulse,"Thu, 25 Sep 2025 00:00:00 GMT",high,5,Today we're releasing a preview of ChatGPT Pulse to Pro users on mobile.,2c79dcb9f6c1c43b9e065df5538465cd
OpenAI and NVIDIA announce strategic partnership to deploy 10 gigawatts of NVIDIA systems,RSS,https://openai.com/index/openai-nvidia-systems-partnership,"Mon, 22 Sep 2025 08:45:00 GMT",critical,5,"OpenAI and NVIDIA announce a strategic partnership to deploy 10 gigawatts of AI datacenters powered by NVIDIA systems, with the first phase launching in 2026.",46fb65c86504064ead8a7832a7598054
Time series foundation models can be few-shot learners,RSS,https://research.google/blog/time-series-foundation-models-can-be-few-shot-learners/,"Tue, 23 Sep 2025 18:00:43 +0000",low,3,Generative AI.,71d8f15780e6f2c388dd5d1859b55318
Towards better health conversations: Research insights on a “wayfinding” AI agent based on Gemini,RSS,https://research.google/blog/towards-better-health-conversations-research-insights-on-a-wayfinding-ai-agent-based-on-gemini/,"Thu, 25 Sep 2025 10:33:00 +0000",critical,3,Generative AI.,44410c618ba88d830ee9c9a065410850
Measuring the performance of our models on real-world tasks,RSS,https://openai.com/index/gdpval,"Thu, 25 Sep 2025 09:00:00 GMT",high,3,"OpenAI introduces GDPval, a new evaluation that measures model performance on real-world economically valuable tasks across 44 occupations.",fe980c771f5b0ab32e4e5066844eb161
CNA is transforming its newsroom with AI,RSS,https://openai.com/index/cna-walter-fernandez,"Mon, 22 Sep 2025 17:17:00 GMT",low,3,"In this Executive Function series from OpenAI, discover how CNA is transforming its newsroom with AI.",d8c167258a7064997d4c06ef8efb6b01
Claude is now generally available in Xcode,www.anthropic.com,https://www.anthropic.com/news/claude-in-xcode,2025-09-25 16:12:54.595334,critical,3,"ProductClaude is now generally available in XcodeSep 15, 2025●1 min readDevelopers can now connect their Claude account to Xcode 26 to power coding intelligence features with Claude Sonnet 4.",ed64527896271eb719d3c6eff227f394
